date,week,title,learning_objectives
2022-07-05T00:00:00Z,1,Welcome! & Data Science Life-cycle,Learners can navigate the platforms that are used to for the course
2022-07-05T00:00:00Z,1,Welcome! & Data Science Life-cycle,Learners can render a file on RStudio Cloud in PDF format
2022-07-05T00:00:00Z,1,Welcome! & Data Science Life-cycle,Learners can list the six elements of the data science lifecycle
2022-07-05T00:00:00Z,1,Welcome! & Data Science Life-cycle,Learners can paraphrase how a file written in a markup language like markdown (.md) differs from a file written in a proprietary file format like .docx
2022-07-05T00:00:00Z,1,Welcome! & Data Science Life-cycle,"Learners can identify four components of an Quarto file (YAML, code chunk, R code, markdown)"
2022-07-12T00:00:00Z,2,Exploratory data analysis using visualization & Data organization in spreadsheets,Exploratory data analysis using visualization & Data organization in spreadsheets
